Nombre,Descripcion,Precio,Categoria,ImagenURL
Pizza Margherita Premium,Tomate san marzano, mozzarella de búfala, albahaca fresca y aceite de oliva virgen,1850,Pizzas,https://images.unsplash.com/photo-1574071318508-1cdbad80ad38
Pasta Carbonara Originale,Auténticos espaguetis con guanciale crujiente, huevo orgánico y pecorino romano,2100,Pastas,https://images.unsplash.com/photo-1612874742237-6526221588e3
Ensalada César Artisan,Pollo grillado a la leña, crotones de masa madre, parmesano reggiano y aderezo secreto,1650,Ensaladas,https://images.unsplash.com/photo-1550304943-4f24f54ddde9
Tiramisú della Nonna,Bizcochos artesanales empapados en espresso italiano, mascarpone real y cacao puro,1200,Postres,https://images.unsplash.com/photo-1571877227200-a0d98ea607e9
Hamburguesa Black Angus,200g de carne premium, queso cheddar añejo, cebolla caramelizada y pan brioche,2400,Hamburguesas,https://images.unsplash.com/photo-1568901346375-23c9450c58cd
Limonada de Hierbabuena,Fresca con limones de estación y toque de jengibre,850,Bebidas,https://images.unsplash.com/photo-1513558161293-cdaf765ed2fd
Café Flat White,Doble shot de espresso con leche microespumada cremosa,750,Cafetería,https://images.unsplash.com/photo-1577968897866-be5015aadc51
